price,product_description,product_id,product_name
969,Democrat against practice road worker.,0,productCharles Bright
835,Hear project produce letter something.,1,productJohn Mckenzie
742,Range direction control type.,2,productAshley Spencer
875,Customer wife young know.,3,productJason Ward
495,Method poor several.,4,productHannah Jennings
745,Get start view effect when free school.,5,productAmber Matthews
183,Bring field into.,6,productJason Burnett DDS
629,Hair all product ahead step.,7,productMelissa Alexander
913,Election dark choose choice them among.,8,productMichele Lamb
960,Head edge maintain training best.,9,productJessica Gill
590,Fine career behind job.,10,productEric Terry
995,Career you foot style magazine.,11,productHeather Miller
255,Table toward family first street fight.,12,productJeremy Alvarez
834,Act could ball sometimes.,13,productEdward Reynolds
834,Base PM seat brother air image.,14,productGary Pennington
609,Seven change soon reveal letter.,15,productAmber Williams
568,Situation arrive make mouth whether.,16,productJeffrey Dawson
635,Work dream final way.,17,productSpencer Hill
713,Point never first then.,18,productWilliam Merritt
153,Sure ground during move social.,19,productAnne Bailey
923,Specific natural generation act.,20,productAmanda James
879,Wish involve community picture age.,21,productLee Garcia
141,Fly Mrs national question even.,22,productDavid Lopez
202,Exist dream take administration.,23,productJames Holder
350,Allow doctor event. General onto carry.,24,productEdward Avery
539,Market imagine resource dream against.,25,productAshley Horn
931,Radio cultural continue.,26,productSherry Mooney
804,Clear gas myself figure.,27,productShawn Palmer
582,Economic minute simply best indicate.,28,productThomas Murphy
427,Food though result war contain.,29,productScott Wade
886,Should feeling begin star let him.,30,productSteven Delacruz
235,Air base strong best rule.,31,productMatthew Brown
188,Buy mean voice create.,32,productAmy Spencer
580,Bad break high follow drive test glass.,33,productDavid Miller
964,Someone hear people real tough.,34,productJeffrey Sandoval
125,Dream since lose.,35,productPatricia West
489,White point evening system.,36,productAbigail Roberts
814,Charge likely spring skill worker.,37,productTimothy Guerra
683,Investment people nature win.,38,productDominique Lowe
900,Method whole professional medical.,39,productDamon Shepherd
741,Actually speak series.,40,productTodd Sullivan
680,Pay fight strong image third.,41,productNathaniel Holt
522,Be best truth over result song history.,42,productMichael Johnson
150,Mind often notice leg. News air ok.,43,productJasmine Welch
881,Us anyone factor professional.,44,productHeather Kane
185,Structure environment baby have.,45,productMaria Watkins
345,Wrong image also rich military water.,46,productRyan Porter
871,Across difference art huge just.,47,productLaura Gonzalez
858,Than arm laugh case college.,48,productMichael Holden
454,Answer area will pretty stay economy.,49,productChristina Burns
